{
  "schema_version": "1.5",
  "project": "crumb",
  "input_authority_ref": {
    "path": "input-authority.json",
    "sha256": "eed9df0566782a999c86a6a26b871a57fe29345267e85a1f56ed16c95c69bc57",
    "size": 2808,
    "media_type": "application/json"
  },
  "requirements": [
    {
      "id": "R1",
      "description": "Record while the active-low GPIO4 button is held and stop on release.",
      "owner": "recording_policy",
      "origin": "USER"
    },
    {
      "id": "R2",
      "description": "Capture the two ICS-41350 microphones as left and right I2S PCM channels and encode a valid stereo WAV.",
      "owner": "audio_capture",
      "origin": "USER"
    },
    {
      "id": "R3",
      "description": "Commit each complete WAV atomically to W25N01GV without exposing a partial recording.",
      "owner": "record_store",
      "origin": "USER"
    },
    {
      "id": "R4",
      "description": "Continue accepting recordings while Wi-Fi is unavailable.",
      "owner": "recording_policy",
      "origin": "USER"
    },
    {
      "id": "R5",
      "description": "Upload committed recordings oldest-first, one at a time.",
      "owner": "upload_service",
      "origin": "USER"
    },
    {
      "id": "R6",
      "description": "POST complete WAV bytes to the authoritative endpoint with filename query parameter and no authentication.",
      "owner": "upload_service",
      "origin": "USER"
    },
    {
      "id": "R7",
      "description": "Delete an uploaded record only after HTTP 200, matching bytes, and non-empty saved; otherwise retain it.",
      "owner": "upload_service",
      "origin": "USER"
    },
    {
      "id": "R8",
      "description": "Keep each uploaded file below the server limit of 50 MiB.",
      "owner": "recording_policy",
      "origin": "USER"
    },
    {
      "id": "R9",
      "description": "Load Wi-Fi credentials from NVS and provision them from a private build reference only when absent.",
      "owner": "credential_service",
      "origin": "USER"
    },
    {
      "id": "R10",
      "description": "Use synchronized real-time filenames after SNTP sync and BOOT/uptime filenames before sync.",
      "owner": "time_service",
      "origin": "USER"
    },
    {
      "id": "R11",
      "description": "Access BQ25180YBGR only for read-only observation and never modify charger configuration.",
      "owner": "charger_monitor",
      "origin": "USER"
    },
    {
      "id": "R12",
      "description": "When capacity is insufficient, reclaim the oldest complete recording without touching active write or upload records.",
      "owner": "record_store",
      "origin": "USER"
    },
    {
      "id": "R13",
      "description": "Use only the input-authority pin assignments and exact external-part identities.",
      "owner": "board_resources",
      "origin": "DERIVED"
    },
    {
      "id": "DR1",
      "description": "Use a grounded ICS-41350/ESP-IDF-supported sample rate and width, with grounded maximum duration and loss threshold; do not guess these values.",
      "owner": "audio_capture",
      "origin": "POLICY"
    },
    {
      "id": "DR2",
      "description": "Credential values remain confined to ignored local private artifacts and are redacted from source, logs, evidence, receipts, and responses.",
      "owner": "credential_service",
      "origin": "POLICY"
    },
    {
      "id": "DR3",
      "description": "Bound queues apply explicit defer/reject backpressure and never silently overwrite active data.",
      "owner": "system_orchestrator",
      "origin": "POLICY"
    },
    {
      "id": "DR4",
      "description": "The final concurrent system preserves recording, storage, upload, time, and recovery ownership without deadlock or data corruption.",
      "owner": "crumb_integration",
      "origin": "DERIVED"
    }
  ],
  "subsystems": [
    {
      "id": "board_resources",
      "dependencies": [],
      "classification": "mcu_native",
      "execution_role": "component",
      "responsibility_layer": "board_resource",
      "registry_search_required": false,
      "required_operations": [
        "initialize",
        "claim_resources",
        "release_resources"
      ],
      "verification_batch": "batch_board",
      "batch_compatible": true,
      "isolation_required": false,
      "isolation_reason": null,
      "hardware_resources": [
        "GPIO4",
        "GPIO5",
        "GPIO14",
        "GPIO18",
        "GPIO19",
        "GPIO23",
        "GPIO25",
        "GPIO26",
        "GPIO27",
        "I2C",
        "SPI",
        "I2S"
      ]
    },
    {
      "id": "charger_monitor",
      "part_number": "BQ25180YBGR",
      "dependencies": [
        "board_resources"
      ],
      "classification": "external_part",
      "execution_role": "component",
      "responsibility_layer": "device_driver",
      "registry_search_required": true,
      "required_operations": [
        "initialize",
        "read_status",
        "reset_recovery"
      ],
      "verification_batch": "batch_charger",
      "batch_compatible": false,
      "isolation_required": true,
      "isolation_reason": "Read-only charger access requires isolated attribution.",
      "hardware_resources": [
        "I2C",
        "GPIO27",
        "GPIO14",
        "BQ25180YBGR"
      ]
    },
    {
      "id": "flash_driver",
      "part_number": "W25N01GV",
      "dependencies": [
        "board_resources"
      ],
      "classification": "external_part",
      "execution_role": "component",
      "responsibility_layer": "device_driver",
      "registry_search_required": true,
      "required_operations": [
        "initialize",
        "read",
        "program",
        "erase_block",
        "read_status",
        "reset_recovery"
      ],
      "verification_batch": "batch_flash",
      "batch_compatible": false,
      "isolation_required": true,
      "isolation_reason": "Program and erase verification mutates flash.",
      "hardware_resources": [
        "SPI",
        "GPIO18",
        "GPIO23",
        "GPIO19",
        "GPIO5",
        "W25N01GV"
      ]
    },
    {
      "id": "audio_capture",
      "part_number": "ICS-41350",
      "dependencies": [
        "board_resources"
      ],
      "classification": "external_part",
      "execution_role": "component",
      "responsibility_layer": "device_driver",
      "registry_search_required": true,
      "required_operations": [
        "initialize",
        "start_capture",
        "read_stereo_pcm",
        "stop_capture",
        "reset_recovery"
      ],
      "verification_batch": "batch_audio",
      "batch_compatible": false,
      "isolation_required": true,
      "isolation_reason": "I2S, DMA, and loss attribution require isolation.",
      "hardware_resources": [
        "I2S",
        "GPIO26",
        "GPIO25",
        "ICS-41350-left",
        "ICS-41350-right",
        "DMA"
      ]
    },
    {
      "id": "button_input",
      "dependencies": [
        "board_resources"
      ],
      "classification": "mcu_native",
      "execution_role": "component",
      "responsibility_layer": "board_resource",
      "registry_search_required": false,
      "required_operations": [
        "initialize",
        "read_level",
        "edge_event"
      ],
      "verification_batch": "batch_button",
      "batch_compatible": true,
      "isolation_required": false,
      "isolation_reason": null,
      "hardware_resources": [
        "GPIO4"
      ]
    },
    {
      "id": "record_store",
      "dependencies": [
        "flash_driver"
      ],
      "classification": "project_custom",
      "execution_role": "component",
      "responsibility_layer": "data_service",
      "registry_search_required": false,
      "required_operations": [
        "initialize",
        "commit_recording",
        "list_oldest_first",
        "open_for_upload",
        "delete_complete_recording",
        "capacity_recovery",
        "reset_recovery"
      ],
      "verification_batch": "batch_store",
      "batch_compatible": false,
      "isolation_required": true,
      "isolation_reason": "Storage tests mutate persistent state.",
      "hardware_resources": [
        "W25N01GV",
        "record-metadata-lock"
      ]
    },
    {
      "id": "wifi_service",
      "dependencies": [],
      "classification": "mcu_native",
      "execution_role": "component",
      "responsibility_layer": "data_service",
      "registry_search_required": false,
      "required_operations": [
        "initialize",
        "connect",
        "disconnect",
        "report_status",
        "reset_recovery"
      ],
      "verification_batch": "batch_wifi",
      "batch_compatible": true,
      "isolation_required": false,
      "isolation_reason": null,
      "hardware_resources": [
        "ESP32-WiFi-radio"
      ]
    },
    {
      "id": "credential_service",
      "dependencies": [],
      "classification": "mcu_native",
      "execution_role": "component",
      "responsibility_layer": "data_service",
      "registry_search_required": false,
      "required_operations": [
        "initialize",
        "read_reference",
        "provision_if_absent"
      ],
      "verification_batch": "batch_credentials",
      "batch_compatible": false,
      "isolation_required": true,
      "isolation_reason": "NVS validation uses a scoped namespace and private references.",
      "hardware_resources": [
        "NVS"
      ]
    },
    {
      "id": "time_service",
      "dependencies": [
        "wifi_service"
      ],
      "classification": "mcu_native",
      "execution_role": "component",
      "responsibility_layer": "data_service",
      "registry_search_required": false,
      "required_operations": [
        "initialize",
        "synchronize",
        "get_time",
        "report_sync_state"
      ],
      "verification_batch": "batch_time",
      "batch_compatible": true,
      "isolation_required": false,
      "isolation_reason": null,